"coffee_name","roaster_name","roaster_city","roaster_country_name"
"Colombia La Palma Y El Tucán Gesha Natural","Equator Coffees","San Rafael","United States"
"Peru Yanesha Geisha Washed Anaerobic","GK Coffee","Yilan","China"
"Guatemala Geisha","Omine Coffee","Taipei","Taiwan"
"Costa Rica La Rejolla Washed Geisha","Willoughby's Coffee & Tea","Branford","United States"
"El Salvador El Matazano Pacamara","Bird Rock Coffee Roasters","San Diego","United States"
"Chelbesa Ethiopia","JBC Coffee Roasters","Madison","United States"
"Chelbesa Ethiopia","JBC Coffee Roasters","Madison","United States"
"Ethiopia Guji Uraga Tebe Burka Natural G1","Samlin Coffee","Taipei","Taiwan"
"Ethiopia Yirgacheffe Washed Banko Gotiti 3","Kakalove Cafe","Chia-Yi","Taiwan"
"Ethiopia Yirgacheffe Washed Banko Gotiti 3","Kakalove Cafe","Chia-Yi","Taiwan"
"Ethiopia Natural Yirgacheffe Adado Feysa Dira","Kakalove Cafe","Chia-Yi","Taiwan"
"Ethiopia Natural Yirgacheffe Adado Feysa Dira","Kakalove Cafe","Chia-Yi","Taiwan"
"Guatemala El Injerto Natural Legendary Gesha 7","Kakalove Cafe","Chia-Yi","Taiwan"
"Guatemala El Injerto Natural Legendary Gesha 7","Kakalove Cafe","Chia-Yi","Taiwan"
"Ethiopia Worka Sakaro Anaerobic Natural","Red Rooster Coffee Roaster","Floyd","United States"
"Colombia La Esperanza Anaerobic","Big Shoulders Coffee","Chicago","United States"
"Ethiopia Gogogu Bekaka #1","Big Shoulders Coffee","Chicago","United States"
"Kenya Gichathaini","Roadmap CoffeeWorks","Lexington","United States"
"Kenya Gichathaini","Roadmap CoffeeWorks","Lexington","United States"
"Kenya Gichathaini","Roadmap CoffeeWorks","Lexington","United States"
"Elida Estate ASD Natural Catuai 15","Dragonfly Coffee Roasters","Henderson","United States"
"Ethiopia Kochere Hama Jet Washing Station","Coffee Please","Taipei","Taiwan"
"Elida Estate Dragonfly Catuai Lot 13","Dragonfly Coffee Roasters","Henderson","United States"
"Kona Red Wine Process","Paradise Roasters","Hilo","United States"
"Candelilla Geisha Natural","JBC Coffee Roasters","Madison","United States"
"Kiamugumo Kenya","JBC Coffee Roasters","Madison","United States"
"Kiamugumo Kenya","JBC Coffee Roasters","Madison","United States"
"Kiamugumo Kenya","JBC Coffee Roasters","Madison","United States"
"Colombia Gesha","SkyTop Coffee","Manlius","United States"
"Ethiopia Kayon Mountain Washed","Roadmap CoffeeWorks","Lexington","United States"
"Ethiopia Gedeb Worka Wuri","Jaunt Coffee Roasters","San Diego","United States"
"Kenya Karatina","Temple Coffee Roasters","Sacramento","United States"
"Kenya Karatina","Temple Coffee Roasters","Sacramento","United States"
"Kenya Karatina","Temple Coffee Roasters","Sacramento","United States"
"La Reforma El Salvador Natural","JBC Coffee Roasters","Madison","United States"
"Panama Geisha","Le Brewlife","Taichung","Taiwan"
"Guatemala COE-NW#2 Sierra Roja Geisha Washed","GK Coffee","Yilan","China"
"Guatemala La Voz","Nostalgia Coffee Roasters","San Diego","United States"
"Guatemala La Voz","Nostalgia Coffee Roasters","San Diego","United States"
"Guatemala La Voz","Nostalgia Coffee Roasters","San Diego","United States"
"Kenya Gatomboya","Drink Coffee Do Stuff","Truckee","United States"
"Kenya Gatomboya","Drink Coffee Do Stuff","Truckee","United States"
"Nicaragua La Bendicion Yellow Maracaturra Natural","Paradise Roasters","Hilo","United States"
"Kona Lactic Washed","Paradise Roasters","Hilo","United States"
"Kenya Kamwangi","Bird Rock Coffee Roasters","San Diego","United States"
"Kenya Kamwangi","Bird Rock Coffee Roasters","San Diego","United States"
"Ethiopia Bench Maji Gesha Village Oma Geisha 1931 Lot 55 Natural","Taster’s Coffee","Taipei","Taiwan"
"Ethiopia Guji Natural Euphora Special Lot","Euphora Coffee","Taipei","Taiwan"
"Primavera Colombia Espresso","JBC Coffee Roasters","Madison","United States"
"Tanzania Gesha Peaberry","Paradise Roasters","Hilo","United States"
"Ethiopia Guji Hambela Kudume Yellow Honey","Coffee Please","Taipei","Taiwan"
"Ethiopia Sidamo Bensa Mirado Natural","LECO Coffee","Kaohsiung","Taiwan"
"Ethiopia Yirgacheffe Botabaa Washed G1 21/01","Kakalove Cafe","Chia-Yi","Taiwan"
"Ethiopia Yirgacheffe Botabaa Washed G1 21/01","Kakalove Cafe","Chia-Yi","Taiwan"
"Yemen Mocca Matari","EK Roast Studio","Pingtung","Taiwan"
"Mojave Vault Series Geisha Natural","Dragonfly Coffee Roasters","Henderson","United States"
"Ethiopia Buku Abela","Home in Harmony","Taipei","Taiwan"
"Colombia Finca Santa Maria","SkyTop Coffee","Manlius","United States"
"Colombia Finca Santa Maria","SkyTop Coffee","Manlius","United States"
"Yemen Mocha Haimi","Dragonfly Coffee Roasters","Henderson","United States"
"Colombia Wush Wush","SkyTop Coffee","Manlius","United States"
"Brazil Gauriroba Natural","SOT Coffee Roaster","Osaka","Japan"
"Rwanda “Silverback Returns”","Simon Hsieh Aroma Roast Coffees","Taoyuan","Taiwan"
"Brazil Ipanema Golden Edition C26 Lychee","GK Coffee","Yilan","China"
"El Jocote Natural","JBC Coffee Roasters","Madison","United States"
"Panama Finca Santa Teresa Summer Gesha","Big Shoulders Coffee","Chicago","United States"
"Ecuador San José de Minas Double-Anaerobic","Peach Coffee Roasters","Johns Creek","United States"
"La Perla Chiquita Ecuador","JBC Coffee Roasters","Madison","United States"
"Las Flores Colombia","JBC Coffee Roasters","Madison","United States"
"Nicaragua Yellow Pacamara Natural","Paradise Roasters","Hilo","United States"
"Ethiopia West Arsi Nensebo Natural G1","Pro Aroma Enterprise Coffee","Taichung","Taiwan"
"Ethiopia Sidama Bona Sweet Natural","Pro Aroma Enterprise Coffee","Taichung","Taiwan"
"Congo Square","Three Keys Coffee","Houston","United States"
"Rwanda Rulindo Tumba","Big Creek Coffee Roasters","Hamilton","Canada"
"Tanzania Sambewe","Roadmap CoffeeWorks","Lexington","United States"
"Rwanda Kinini Village Natural","PT's Coffee Roasting Co.","Topeka","United States"
"Rwanda Kinini Village Natural","PT's Coffee Roasting Co.","Topeka","United States"
"Tanzania Ngila Estate SL28","Paradise Roasters","Hilo","United States"
"Ethiopia Washed Sidama Nafasha 74158 21/01","Kakalove Cafe","Chia-Yi","Taiwan"
"Ethiopia Washed Sidama Nafasha 74158 21/01","Kakalove Cafe","Chia-Yi","Taiwan"
"Ethiopia Tibe Haro Uraga","Red Rooster Coffee Roaster","Floyd","United States"
"Ethiopia Natural Guji Blue Donkey 21/01","Kakalove Cafe","Chia-Yi","Taiwan"
"Ethiopia Natural Guji Blue Donkey 21/01","Kakalove Cafe","Chia-Yi","Taiwan"
"Kenya AA Top Gathambi Station","GK Coffee","Yilan","China"
"Kenya AA Top Gathambi Station","GK Coffee","Yilan","China"
"Ethiopia Guji Gerba Station G1 Natural Espresso","GK Coffee","Yilan","China"
"Kenya Karindudu AA","Big Shoulders Coffee","Chicago","United States"
"Ethiopia Guji Anaerobic","Big Shoulders Coffee","Chicago","United States"
"La Soledad Colombia","JBC Coffee Roasters","Madison","United States"
"Colombia Huila Acevedo El Paraiso","Big Shoulders Coffee","Chicago","United States"
"Love of Desolate","Desolate Cafe","Nantou","Taiwan"
"Ethiopia Niguse Gemeda Mude Natural","Desolate Cafe","Nantou","Taiwan"
"La Estrella Carbonic Geisha Reserve","Corvus Coffee Roasters","Denver","United States"
"Ethiopia Guji Wush Wush Anaerobic Natural","Coffee Please","Taipei","Taiwan"
"Ethiopia Guji Wush Wush","Paradise Roasters","Hilo","United States"
"Ethiopia Yirgacheffe Israel Degfa Natural Gr.1","CofFeeling","Kaohsiung","Taiwan"
"Panama Elida Estate Washed","modcup coffee","Jersey City","United States"
"Bourbon Barrel Aged Ethiopia Cold Brew","Regent Coffee","Glendale","United States"
"Kona Maragogype Natural","Paradise Roasters","Hilo","United States"
"Ethiopia Natural Guji Hambella Wate Peaberry","Kakalove Cafe","Chia-Yi","Taiwan"
"Ethiopia Natural Guji Hambella Wate Peaberry","Kakalove Cafe","Chia-Yi","Taiwan"
"Ethiopia Guji Shakiso Dambi Udo Natural Anaerobic","Coffee Please","Taipei","Taiwan"
"Ethiopia Natural Guji","Kakalove Cafe","Chia-Yi","Taiwan"
"Ethiopia Natural Guji","Kakalove Cafe","Chia-Yi","Taiwan"
"Ethiopia Guji Shakiso Dambi Udo Honey","Coffee Please","Taipei","Taiwan"
"Colombia Pink Bourbon Honey","Bird Rock Coffee Roasters","San Diego","United States"
"Kona SL34 Sweet Spot","Kona Farm Direct","Holualoa","United States"
"Haraaz Red","JBC Coffee Roasters","Madison","United States"
"Panama Elida Green-Tip Geisha La Torre ASD","Willoughby's Coffee & Tea","Branford","United States"
"Kona Peaberry","Big Island Coffee Roasters","Mountain View","United States"
"SL28","Hala Tree Kona Coffee","Captain Cook","United States"
"Bourbon Pointu Natural","Kona Farm Direct","Holualoa","United States"
"Ethiopia Guji Hambela Buku Abel Slow Dry Natural 2400m","Atom Coffee Roasters","Douliou City","Taiwan"
"Panama Boquete Flor De Mariposa Geisha Espresso","Kakalove Cafe","Chia-Yi","Taiwan"
"Panama Boquete Flor De Mariposa Geisha Espresso","Kakalove Cafe","Chia-Yi","Taiwan"
"Colombia Monteblanco Geisha","Merge Coffee Company","Harrisonburg","United States"
"Ethiopia Gedeo Kochere Reko Natural","Interpretation Coffee","Chia-Yi","Taiwan"
"Ethiopia Gedeo Kochere Reko Natural","Interpretation Coffee","Chia-Yi","Taiwan"
"Aged Sumatra Ulos Batak 2015","Paradise Roasters","Hilo","United States"
"Kona Uluwehi SL34","Paradise Roasters","Hilo","United States"
"Colombia Pink Bourbon Finca El Chaparote","Paradise Roasters","Hilo","United States"
"Ethiopia Neja Fadil","Bird Rock Coffee Roasters","San Diego","United States"
"Panama Finca Santa Teresa Lot 9","Old World Coffee Lab","Reno","United States"
"Panama Finca Santa Teresa Lot 9","Old World Coffee Lab","Reno","United States"
"Ethiopia Halo Hartume Daniel Mijane","Old World Coffee Lab","Reno","United States"
"Colombia Cauca El Paraiso","SOT Coffee Roaster","Osaka","Japan"
"Taiwan Songyue Geisha","SOT Coffee Roaster","Osaka","Japan"
"Ethiopia Sidamo Washed","Coffee Please","Taipei","Taiwan"
"Ethiopia Guji Uraga Washed","Coffee Please","Taipei","Taiwan"
"Ethiopia Suke Quto Single-Origin Espresso","Temple Coffee Roasters","Sacramento","United States"
"Trust the Process — Full Natural","Red Rooster Coffee Roaster","Floyd","United States"
"Colombia Finca El Caucho Pink Bourbon","Paradise Roasters","Hilo","United States"
"Colombia Antioquia Natural Carbonic Maceration Caturra","Kakalove Cafe","Chia-Yi","Taiwan"
"Colombia Antioquia Natural Carbonic Maceration Caturra","Kakalove Cafe","Chia-Yi","Taiwan"
"Colombia La Gallera Estate","Evie's Cafe","Chia-Yi","Taiwan"
"Colombia La Gallera Estate","Evie's Cafe","Chia-Yi","Taiwan"
"Colombia Java El Edén Limited Edition","Brioso Coffee","Columbus","United States"
"Finca La Maria Geisha Natural","Blues Brew Coffee","Taipei","Taiwan"
"Angamaza","JBC Coffee Roasters","Madison","United States"
"Angamaza","JBC Coffee Roasters","Madison","United States"
"Kona Geisha Champagne Natural","Paradise Roasters","Hilo","United States"
"Dafis Abafita Natural Ethiopia","PT's Coffee Roasting Co.","Topeka","United States"
"Ka’u Yellow Bourbon","Big Island Coffee Roasters","Mountain View","United States"
"Kinini Village Rwanda","PT's Coffee Roasting Co.","Topeka","United States"
"Kinini Village Rwanda","PT's Coffee Roasting Co.","Topeka","United States"
"Ethiopia Yirgacheffe Cleopatra Natural","Quartet Kaffe","Taipei","Taiwan"
"Guatemala Santa Felisa Solar Eclipse Gesha Natural","Euphora Coffee","Taipei","Taiwan"
"Panama Hacienda La Esmeralda Gesha","Big Shoulders Coffee","Chicago","United States"
"Ethiopia Sidama Telamo FTO Natural","Souvenir Coffee","Berkeley","United States"
"Ethiopia Grade 1 Chelchele","Nostalgia Coffee Roasters","San Diego","United States"
"Taiwan Alishan Zhou-Zhu-Yuan Farm Estate Reserve Washed","Simon Hsieh Aroma Roast Coffees","Taoyuan","Taiwan"
"Taiwan Alishan Zhou-Zhu-Yuan Farm Estate Reserve Washed","Simon Hsieh Aroma Roast Coffees","Taoyuan","Taiwan"
"Panama Elida ASD Natural","modcup coffee","Jersey City","United States"
"Peru Yanesha Geisha","94 Fresh Coffee","Kaohsiung","Taiwan"
"Kona Red Bourbon Anaerobic Washed Uluwehi Farm","Paradise Roasters","Hilo","United States"
"Wush Wush","Red Rooster Coffee Roaster","Floyd","United States"
"Honey Typica Anaerobic","Hala Tree Kona Coffee","Captain Cook","United States"
"Geisha","Hala Tree Kona Coffee","Captain Cook","United States"
"Panama Abu Natural ASD Geisha BOP GN11","Kakalove Cafe","Chia-Yi","Taiwan"
"Panama Abu Natural ASD Geisha BOP GN11","Kakalove Cafe","Chia-Yi","Taiwan"
"Ethiopia Kochere Boji","Lexington Coffee Roasters","Lexington","United States"
"Panama Finca Minerva-Mirage Pacamara BOP PAC04","Kakalove Cafe","Chia-Yi","Taiwan"
"Panama Finca Minerva-Mirage Pacamara BOP PAC04","Kakalove Cafe","Chia-Yi","Taiwan"
"Panama Finca Minerva-Mirage Pacamara BOP PAC04","Kakalove Cafe","Chia-Yi","Taiwan"
"Panama Finca Minerva-Mirage Pacamara BOP PAC04","Kakalove Cafe","Chia-Yi","Taiwan"
"Tanzania Shimiligwanda","Lexington Coffee Roasters","Lexington","United States"
"Ethiopia Yirgacheffe Natural Haru Suke G1","Kakalove Cafe","Chia-Yi","Taiwan"
"Ethiopia Yirgacheffe Natural Haru Suke G1","Kakalove Cafe","Chia-Yi","Taiwan"
"Finca Sophia Gesha Washed","Equator Coffees","San Rafael","United States"
"Colombia Granja La Esperanza Java Anaerobic","Bird Rock Coffee Roasters","San Diego","United States"
"Shantawene Ethiopia Daya Bensa Natural","Cafe Virtuoso","San Diego","United States"
"Kenya AA FAQ","Small Eyes Cafe","Yilan","China"
"Kenya AA FAQ","Small Eyes Cafe","Yilan","China"
"Ardent Ethiopia Natural","JBC Coffee Roasters","Madison","United States"
"GW01 Finca Sophia Olympus Geisha","GK Coffee","Yilan","China"
"Taiwan Geisha Honey","Paradise Roasters","Hilo","United States"
"Camilina Geisha","Bird Rock Coffee Roasters","San Diego","United States"
"Hacienda La Esmeralda Buenos Aires Geisha Natural","PT's Coffee Roasting Co.","Topeka","United States"
"Hacienda La Esmeralda Buenos Aires Geisha Natural","PT's Coffee Roasting Co.","Topeka","United States"
"Ethiopia Sidama Bona Washed G1","Singsun Coffee","Hsinchu","Taiwan"
"Finca Santa Isabel","El Gran Café","Antigua","Antigua and Barbuda"
"Finca San Carlos","El Gran Café","Antigua","Antigua and Barbuda"
"Finca San Carlos","El Gran Café","Antigua","Antigua and Barbuda"
"Ethiopia Natural Guji D Minor Special Lot","Kakalove Cafe","Chia-Yi","Taiwan"
"Ethiopia Natural Guji D Minor Special Lot","Kakalove Cafe","Chia-Yi","Taiwan"
"2020 Savage Auction Deborah Carbonic-Macerated Natural Geisha","Kakalove Cafe","Chia-Yi","Taiwan"
"2020 Savage Auction Deborah Carbonic-Macerated Natural Geisha","Kakalove Cafe","Chia-Yi","Taiwan"
"Ethiopia Bombe Mountains","modcup coffee","Jersey City","United States"
"Coffea Diversa Rume Sudan Winey","Paradise Roasters","Hilo","United States"
"Hawai’i Puna Anaerobic Washed","Paradise Roasters","Hilo","United States"
"Hawai’i Puna Anaerobic Washed","Paradise Roasters","Hilo","United States"
"Ethiopia Natural Guji Kercha Lot Riverside","Kakalove Cafe","Chia-Yi","Taiwan"
"Ethiopia Natural Guji Kercha Lot Riverside","Kakalove Cafe","Chia-Yi","Taiwan"
"Buna Boka #1","JBC Coffee Roasters","Madison","United States"
"El Jardin","JBC Coffee Roasters","Madison","United States"
"Kenya Wachuri","Equator Coffees","San Rafael","United States"
"Kenya Wachuri","Equator Coffees","San Rafael","United States"
"Kenya Baragwi Guama AB","Flight Coffee Co.","Bedford","United States"
"Kenya Thunguri AA","Klatch Coffee","Los Angeles","United States"
"Kenya Kirinyaga Kii","Small Eyes Cafe","Yilan","China"
"Kenya Kirinyaga Kii","Small Eyes Cafe","Yilan","China"
"Kenya Kirinyaga Kii","Small Eyes Cafe","Yilan","China"
"Kenya Kirinyaga Kii","Small Eyes Cafe","Yilan","China"
"Kenya Rungeto","Steady State Roasting","Carlsbad","United States"
"Kenya Rungeto","Steady State Roasting","Carlsbad","United States"
"Kenya Rungeto","Steady State Roasting","Carlsbad","United States"
"Kenya Rungeto","Steady State Roasting","Carlsbad","United States"
"Kenya AA Top Gatomboya","States Coffee","Martinez","United States"
"Kenya AA Top Gatomboya","States Coffee","Martinez","United States"
"Ethiopia Banko Gotiti","Bird Rock Coffee Roasters","San Diego","United States"
"Ethiopia Yabitu Koba","Amavida Coffee Roasters","Santa Rosa Beach","United States"
"Ethiopia Banko Gotiti","PT's Coffee Roasting Co.","Topeka","United States"
"Ethiopia Banko Gotiti","PT's Coffee Roasting Co.","Topeka","United States"
"Colombia Asobombo Inza","Flight Coffee Co.","Bedford","United States"
"Panama Boquete Torre Lot #1 Geisha Honey","Bona Kafo Roastery","Kaohsiung","Taiwan"
"Yellow Caturra (special lot)","Miranda Farms","Ka'u","Israel"
"Hawai’i Kilauea Volcano Yeast Fermentation Washed","Paradise Roasters","Hilo","United States"
"Hawai’i Kilauea Volcano Yeast Fermentation Washed","Paradise Roasters","Hilo","United States"
"Kona Pink Honey Black Rock Farm","Paradise Roasters","Hilo","United States"
"El Salvador Santa Elena Pacamara","GK Coffee","Yilan","China"
"Ethiopia Sheka Kawo Kamina Natural","Paradise Roasters","Hilo","United States"
"Ethiopia Yirgacheffe Natural Farm Direct","Dragonfly Coffee Roasters","Henderson","United States"
"Colombia San Luís Gesha","Peach Coffee Roasters","Johns Creek","United States"
"Karani Kenya","JBC Coffee Roasters","Madison","United States"
"Karani Kenya","JBC Coffee Roasters","Madison","United States"
"Karani Kenya","JBC Coffee Roasters","Madison","United States"
"Karani Kenya","JBC Coffee Roasters","Madison","United States"
"Miraflores Colombia","JBC Coffee Roasters","Madison","United States"
"Kenya Gicherori","Temple Coffee Roasters","Sacramento","United States"
"Kenya Gicherori","Temple Coffee Roasters","Sacramento","United States"
"Wush Wush Ginbo Keffa Ethiopia","Equiano Coffee","Eugene","United States"
"Burundi Karehe","Boon Boona Coffee","Renton","United States"
"Estelí Nicaragua","Dávila Kafe","Washington","United States"
"Colombia Finca El Roblar","BeanFruit Coffee Co.","Jackson","United States"
"Guatemala Bella Carmona","Conscious Cup Coffee Roasters","Crystal Lake","United States"
"Guatemala Bella Carmona","Conscious Cup Coffee Roasters","Crystal Lake","United States"
"Ethiopia Yirgacheffe Kochere Debo","Jackrabbit Java","Thermopolis","United States"
"Kilauea Volcano Champagne Natural","Paradise Roasters","Hilo","United States"
"Kilauea Volcano Champagne Natural","Paradise Roasters","Hilo","United States"
"Nicaragua La Benedicion SL28 Natural","Paradise Roasters","Hilo","United States"
"Colombia Tolima Geisha","Paradise Roasters","Hilo","United States"
"Kenya AA Kirinyaga Kii","94 Fresh Coffee","Kaohsiung","Taiwan"
"Kenya AA Kirinyaga Kii","94 Fresh Coffee","Kaohsiung","Taiwan"
"Colombia Antioquia La Papaya Bourbon Chiroso","94 Fresh Coffee","Kaohsiung","Taiwan"
"Karimiuki Espresso","JBC Coffee Roasters","Madison","United States"
"Karimiuki Espresso","JBC Coffee Roasters","Madison","United States"
"Karimiuki Espresso","JBC Coffee Roasters","Madison","United States"
"Karimiuki Espresso","JBC Coffee Roasters","Madison","United States"
"Karimiuki Kenya","JBC Coffee Roasters","Madison","United States"
"Karimiuki Kenya","JBC Coffee Roasters","Madison","United States"
"Karimiuki Kenya","JBC Coffee Roasters","Madison","United States"
"Karimiuki Kenya","JBC Coffee Roasters","Madison","United States"
"DR Congo, Gera Village, SOPACDI","Conscious Cup Coffee Roasters","Crystal Lake","United States"
"El Floral Colombia","JBC Coffee Roasters","Madison","United States"
"El Salvador Geisha Natural","Paradise Roasters","Hilo","United States"
"Taiwan Natural Alishan Zhuo-Wu Farm Geisha","Kakalove Cafe","Chia-Yi","Taiwan"
"Taiwan Natural Alishan Zhuo-Wu Farm Geisha","Kakalove Cafe","Chia-Yi","Taiwan"
"Brazil Ipanema Black Edition A-41 Red Cherry","GK Coffee","Yilan","China"
"Costa Rica Hacienda Tobosi Copey Villa Sarchi Black Honey","Atom Coffee Roasters","Douliou City","Taiwan"
"Red Bourbon Natural Exclusive Reserve","Hala Tree Kona Coffee","Captain Cook","United States"
"Kona Classic Black Rock Farm","Paradise Roasters","Hilo","United States"
"Colombia Cauca At’e","States Coffee & Mercantile","Martinez","United States"
"Ignacio Quintero Colombia","JBC Coffee Roasters","Madison","United States"
"Ka’u Giant Maragogipe","Big Island Coffee Roasters","Mountain View","United States"
"Kenya Embu Gicherori Factory AA Top","GK Coffee","Yilan","China"
"Kenya Embu Gicherori Factory AA Top","GK Coffee","Yilan","China"
"Colombia Finca Lord Baltimore Papayo","Paradise Roasters","Hilo","United States"
"Mocha Java","Thanksgiving Coffee Company","Fort Bragg","United States"
"Kenya Tuikit Factory AA","Kakalove Cafe","Chia-Yi","Taiwan"
"Kenya Tuikit Factory AA","Kakalove Cafe","Chia-Yi","Taiwan"
"Kenya Tuikit Factory AA","Kakalove Cafe","Chia-Yi","Taiwan"
"Kenya Tuikit Factory AA","Kakalove Cafe","Chia-Yi","Taiwan"
"Kenya Tuikit Factory AA","Kakalove Cafe","Chia-Yi","Taiwan"
"Kenya Tuikit Factory AA","Kakalove Cafe","Chia-Yi","Taiwan"
"Abu Natural Panama Geisha","Klatch Coffee","Los Angeles","United States"
"Gesha Village Single-Variety Gesha Special Selection","Plat Coffee Roastery","Hong Kong","China"
"Gesha Village Single-Variety Gesha Special Selection","Plat Coffee Roastery","Hong Kong","China"
"Monteblanco Cold Fermentation Geisha","Steady State Roasting Company","Carlsbad","United States"
"Yemen Al-Obbarat","Paradise Roasters","Hilo","United States"
"Ecuador Quilanga Typica Yeast Fermentation","Paradise Roasters","Hilo","United States"
"Ethiopia Wush Wush","Revel Coffee","Billings","United States"
"Costa Rica Luis Campos Anaerobic","Revel Coffee","Billings","United States"
"Colombia Granja La Esperanza Tres Dragones","PT's Coffee Roasting Co.","Topeka","United States"
"Colombia Finca La Loma Microlot","BeanFruit Coffee Co.","Jackson","United States"
"Elida Natural Dragonfly Lot","Dragonfly Coffee Roasters","Henderson","United States"
"Kona Laurina Pointu","Kona Farm Direct","Holualoa","United States"
"Kenya Kiri Peaberry","Bird Rock Coffee Roasters","San Diego","United States"
"Kenya Kiri Peaberry","Bird Rock Coffee Roasters","San Diego","United States"
"Panama Hacienda La Esmeralda Geisha Natural Special Auction ES-N-2","Euphora Coffee","Taipei","Taiwan"
"El Salvador Finca El Cerro Natural","Red Rooster Coffee Roaster","Floyd","United States"
"El Salvador Finca El Cerro Natural","Red Rooster Coffee Roaster","Floyd","United States"
"El Salvador Finca El Cerro Natural","Red Rooster Coffee Roaster","Floyd","United States"
"El Salvador Finca El Cerro Natural","Red Rooster Coffee Roaster","Floyd","United States"
"El Salvador Finca El Cerro Natural","Red Rooster Coffee Roaster","Floyd","United States"
"Panama Esmeralda Geisha Natural","Paradise Roasters","Hilo","United States"
"Kenya FSC AB","Black Coffee In Black Jar","Taichung","Taiwan"
"Kenya FSC AB","Black Coffee In Black Jar","Taichung","Taiwan"
"Kenya FSC AB","Black Coffee In Black Jar","Taichung","Taiwan"
"Kenya FSC AB","Black Coffee In Black Jar","Taichung","Taiwan"
"Ceri Ceri Meriah Coffee","Mother Pigeons","Jakarta","Indonesia"
"Alamendah Patuha Coffee","Mother Pigeons","Jakarta","Indonesia"
"Alamendah Patuha Coffee","Mother Pigeons","Jakarta","Indonesia"
"Panama Esmeralda Geisha Portón Oro Yeast","Klatch Coffee","Los Angeles","United States"
"Panama Elida Geisha Natural 1029","Klatch Coffee","Los Angeles","United States"
"Port of Mokha Yemen JSP","Plat Coffee Roastery","Hong Kong","China"
"Port of Mokha Yemen JSP","Plat Coffee Roastery","Hong Kong","China"
"Panama Elida Natural Catuai","Klatch Coffee","Los Angeles","United States"
"Washed Geisha Hacienda La Esmeralda Jaramillo Special","Dragonfly Coffee Roasters","Henderson","United States"
"Panama Perci Geisha Natural","Willoughby's Coffee & Tea","Branford","United States"
"Elida Estate Geisha Green-Tip Natural","Dragonfly Coffee Roasters","Henderson","United States"
"Gesha Village Lot #85 Natural","JBC Coffee Roasters","Madison","United States"
"Gesha Village Lot #85 Natural","JBC Coffee Roasters","Madison","United States"
"Best of Panama GNEP-01 Elida Geisha Green Tip Natural","Willoughby's Coffee & Tea","Branford","United States"
"Geisha XO","Bird Rock Coffee Roasters","San Diego","United States"
"Colombia Finca La Maria Geisha Natural","Klatch Coffee","Los Angeles","United States"
"Panama Finca Kalithea Natural Geisha","Kakalove Café","Chia-Yi","Taiwan"
"Panama Finca Kalithea Natural Geisha","Kakalove Café","Chia-Yi","Taiwan"
"Panama Hacienda La Esmeralda Super Mario 6 Geisha","Dragonfly Coffee Roasters","Henderson","United States"
"Panama Geisha Alto Jaramillo","Caffe Luxxe","Santa Monica","United States"
"Colombia Laderas del Tapias Estate Natural Geisha","CafeTaster","Taipei","Taiwan"
"Gesha Village Natural Lot #19","GK Coffee","Yilan","China"
"Gesha Village Natural Lot #19","GK Coffee","Yilan","China"
"Gesha Village 1931 Lot 27","Mudhouse Coffee Roasters","Charlottesville","United States"
"Panama Finca San Sebastian","Jackrabbit Java","Thermopolis","United States"
"Panama Finca San Sebastian","Jackrabbit Java","Thermopolis","United States"
"El Salvador","Plat Coffee Roastery","Hong Kong","China"
"El Salvador","Plat Coffee Roastery","Hong Kong","China"
"El Salvador","Plat Coffee Roastery","Hong Kong","China"
"El Salvador","Plat Coffee Roastery","Hong Kong","China"
"Cup of Excellence Rwanda Champion","Difference Coffee","London","United Kingdom"
"Cup of Excellence Rwanda Champion","Difference Coffee","London","United Kingdom"
"Geisha Village Auction Lot #11","JBC Coffee Roasters","Madison","United States"
"Kenya Kimaruri","Caffe Luxxe","Santa Monica","United States"
"Kenya Kimaruri","Caffe Luxxe","Santa Monica","United States"
"Kenya Kimaruri","Caffe Luxxe","Santa Monica","United States"
"Kenya Kimaruri","Caffe Luxxe","Santa Monica","United States"
