"coffee_name","roaster_name","roaster_city","roaster_country_name"
"Colombia Pink Bourbon","modcup","Jersey City","United States"
"Kenya Kiambu Mandela Estate AA Washed Process","Buon Caffe","Taipei","Taiwan"
"Kenya Kiambu Mandela Estate AA Washed Process","Buon Caffe","Taipei","Taiwan"
"Costa Rica Volcán Azul Geisha Yeast-Washed","Kafe Coffee Roastery","Zhubei","Taiwan"
"Kenya Gichathaini","Temple Coffee","Sacramento","United States"
"Kenya Gichathaini","Temple Coffee","Sacramento","United States"
"Kenya Gichathaini","Temple Coffee","Sacramento","United States"
"Guatemala Retiro del Quisaya Natural Process","Durango Coffee Company","Durango","Mexico"
"Guatemala Retiro del Quisaya Natural Process","Durango Coffee Company","Durango","Mexico"
"Guatemala Retiro del Quisaya Natural Process","Durango Coffee Company","Durango","Mexico"
"Ethiopia Sidama Karamo Anaerobic Natural","RamsHead Coffee Roasters","Bozeman","United States"
"Kabiufa Papua New Guinea","JBC Coffee Roasters","Madison","United States"
"Kabiufa Papua New Guinea","JBC Coffee Roasters","Madison","United States"
"Ka‘u Red Catuai Peaberry","Paradise Roasters","Hilo","United States"
"Ethiopia Kayon Mountain","Roadmap CoffeeWorks","Lexington","United States"
"Panama Finca Las Nubes Geisha Microlot","Vermont Artisan Coffee & Tea","Waterbury Center","United States"
"Guatemala El Milagro Bourbon Especial","PT's Coffee Roasting Co.","Topeka","United States"
"Guatemala El Milagro Bourbon Especial","PT's Coffee Roasting Co.","Topeka","United States"
"Costa Rica William Mora","Press Coffee","Phoenix","United States"
"Winter 2022 Allocation Colombia","Press Coffee","Phoenix","United States"
"Laura’s Reserve SL34","Hula Daddy Kona Coffee","Holualoa","United States"
"Laura’s Reserve SL34","Hula Daddy Kona Coffee","Holualoa","United States"
"El Salvador 2022 COE#17 El Mirador Washed Gesha","Kakalove Cafe","Chia-Yi","Taiwan"
"El Salvador 2022 COE#17 El Mirador Washed Gesha","Kakalove Cafe","Chia-Yi","Taiwan"
"Panama ABU Washed Gesha Lot GW57","Kakalove Cafe","Chia-Yi","Taiwan"
"Panama ABU Washed Gesha Lot GW57","Kakalove Cafe","Chia-Yi","Taiwan"
"Guatemala Natural El General Bistro Lot Espresso","Kakalove Cafe","Chia-Yi","Taiwan"
"Guatemala Natural El General Bistro Lot Espresso","Kakalove Cafe","Chia-Yi","Taiwan"
"Guatemala Natural El General Bistro Lot Espresso","Kakalove Cafe","Chia-Yi","Taiwan"
"Guatemala Natural El General Bistro Lot Espresso","Kakalove Cafe","Chia-Yi","Taiwan"
"Ethiopia Washed Sidama Rumudamo","Kakalove Cafe","Chia-Yi","Taiwan"
"Ethiopia Washed Sidama Rumudamo","Kakalove Cafe","Chia-Yi","Taiwan"
"Kenya Kiambu AA","JH Roaster","Taipei","Taiwan"
"Kenya Kiambu AA","JH Roaster","Taipei","Taiwan"
"Colombia Geisha Allium","Nostalgia Coffee Roasters","San Diego","United States"
"Wilton Benitez Orange Bourbon","JBC Coffee Roasters","Madison","United States"
"Kayon Mountain Ethiopia","JBC Coffee Roasters","Madison","United States"
"Ethiopia Kochere Arefasa Washed G1","Desolate Cafe","Nantou","Taiwan"
"Colombia Granja Paraíso Java P14","Paradise Roasters","Hilo","United States"
"Chelbessa Ethiopia","JBC Coffee Roasters","Madison","United States"
"Ethiopia Gesha Village Illubabor Forest Lot 22/043 (Single-Terroir) Natural Process","Buon Caffe","Taipei","Taiwan"
"Ethiopia Gera Genji Challa","Mostra Coffee","San Diego","United States"
"Panama Hartmann Estate Chicho Gallo Amaro Gayo Natural BOP#1","Buon Caffe","Taipei","Taiwan"
"Ethiopia Uchoro Nansebo Washed","Red Rooster Coffee Roaster","Floyd","United States"
"Colombia Finca Samboni Gesha Anaerobic Natural","Red Rooster Coffee Roaster","Floyd","United States"
"Kambera Inari Roasting","BEI Coffee Roasters","Hong Kong","China"
"Kambera Inari Roasting","BEI Coffee Roasters","Hong Kong","China"
"Colombia Don Correa Gesha","Roadmap CoffeeWorks","Lexington","United States"
"Ethiopia BergWu Maker Series Yirgacheffe Wuri G1 Lot MW21/02","Angeles Roastery","Hong Kong","China"
"Ethiopia BergWu Maker Series Yirgacheffe Wuri G1 Lot MW21/02","Angeles Roastery","Hong Kong","China"
"Mexico Finca Santa Cruz COE#1b","Mute Roaster","Macao","China"
"Wilton Benitez Geisha","JBC Coffee Roasters","Madison","United States"
"Colombia Cerro Azul Geisha","Bird Rock Coffee Roasters","San Diego","United States"
"Yirgacheffe Mengesha Natural","Regent Coffee","Glendale","United States"
"Yirgacheffe Mengesha Natural","Regent Coffee","Glendale","United States"
"Panama Geisha Finca Debra Symbiosis","Theory Coffee Roasters","Redding","United States"
"Panama Geisha Finca Debra Echo","Theory Coffee Roasters","Redding","United States"
"Ethiopia Idido Anaerobic Natural","Paradise Roasters","Hilo","United States"
"Mexico Cup of Excellence #7","SkyTop Coffee","Manlius","United States"
"Ethiopia Reko Yirgacheffe","Temple Coffee","Sacramento","United States"
"Double-Anaerobic Fermentation Tamiru Tadesse","Genesis Coffee Lab","Big Lake","United States"
"Ethiopia Chelbesa Danche Yirgacheffe","Jaunt Coffee Roasters","San Diego","United States"
"Ethiopia Chelbesa Danche Yirgacheffe","Jaunt Coffee Roasters","San Diego","United States"
"Ethiopia Honey Process Tamiru Tadesse","Genesis Coffee Lab","Big Lake","United States"
"Ethiopia Halo Beriti","Roadmap CoffeeWorks","Lexington","United States"
"Narsha Gesha","Corvus Coffee","Denver","United States"
"Don Roger & Isabel’s Natural Fruit Symphony","Joe Bean Roasters","Rochester","United States"
"Don Roger & Isabel’s Natural Fruit Symphony","Joe Bean Roasters","Rochester","United States"
"Don Roger & Isabel’s Natural Fruit Symphony","Joe Bean Roasters","Rochester","United States"
"Don Roger & Isabel’s Natural Fruit Symphony","Joe Bean Roasters","Rochester","United States"
"Ethiopia Bench Maji Gesha Special Natural Lot 03","Kakalove Cafe","Chia-Yi","Taiwan"
"Ethiopia Bench Maji Gesha Special Natural Lot 03","Kakalove Cafe","Chia-Yi","Taiwan"
"Ethiopia Natural Yirgacheffe Burtukaana Danche","Kakalove Cafe","Chia-Yi","Taiwan"
"Ethiopia Natural Yirgacheffe Burtukaana Danche","Kakalove Cafe","Chia-Yi","Taiwan"
"Ethiopia Hateso Guji Washed","RamsHead Coffee Roasters","Bozeman","United States"
"Guatemala El Injerto Pacamara","Equator Coffees","San Rafael","United States"
"Colombia Finca Samboni Gesha Anaerobic Natural","Magnolia Coffee","Charlotte","United States"
"Rwanda Cyesha Natural","Magnolia Coffee","Charlotte","United States"
"Espresso No. 3","El Gran Cafe","Antigua","Antigua and Barbuda"
"Finca Santa Isabel","El Gran Cafe","Antigua","Antigua and Barbuda"
"Full Moon Espresso","Kasasagi Coffee Roasters","Taipei","Taiwan"
"Ethiopia Sidama Tamiru Tadesse Anaerobic Natural Special Auction Lot","Euphora Coffee","Taipei","Taiwan"
"Colombia La Esperanza 100% Geisha Hanashaku","VERYTIME","Taoyuan","Taiwan"
"Kona Extra Fancy","San Francisco Bay Coffee Company","Lincoln","United States"
"Costa Rica Las Lajas Perla Negra","Durango Coffee Company","Durango","Mexico"
"Ecuador COE 1st place Arashi Typica Mejorado Washed","GK Coffee","Yilan","China"
"Ecuador COE 1st place Arashi Typica Mejorado Washed","GK Coffee","Yilan","China"
"Ethiopia Getu Kurume Natural","Fumi Coffee Company","Hsinchu","Taiwan"
"Papua New Guinea Wahgi Valley Sigri Estate Peaberry","Cozy House Coffee","Taipei","Taiwan"
"Ethiopia Gera Estate Anaerobic Natural","Magnolia Coffee","Charlotte","United States"
"Costa Rica Cerro Dragon Geisha Honey","RamsHead Coffee Roasters","Bozeman","United States"
"Taiwan Natural Alishan Zhuo-Wu Geisha","Kakalove Cafe","Chia-Yi","Taiwan"
"Taiwan Natural Alishan Zhuo-Wu Geisha","Kakalove Cafe","Chia-Yi","Taiwan"
"Kenya Gathaithi AA","Cimarron Coffee Roasters","Montrose","United States"
"Kenya Gathaithi AA","Cimarron Coffee Roasters","Montrose","United States"
"Kenya Gathaithi AA","Cimarron Coffee Roasters","Montrose","United States"
"Colombia Jardines del Eden Pink Bourbon Wine Yeast Honey","The Angry Roaster","Toronto","Canada"
"Colombia Jardines del Eden Pink Bourbon Wine Yeast Honey","The Angry Roaster","Toronto","Canada"
"Colombia Cerro Azul Enano","Equator Coffees","San Rafael","United States"
"Peru Incahuasi","Press Coffee","Phoenix","United States"
"Peru Incahuasi","Press Coffee","Phoenix","United States"
"Peru Incahuasi","Press Coffee","Phoenix","United States"
"Reina de la Asuncion Ecuador","JBC Coffee Roasters","Madison","United States"
"Reina de la Asuncion Ecuador","JBC Coffee Roasters","Madison","United States"
"Kahiko","Hula Daddy Kona Coffee","Holualoa","United States"
"Kenya Ndumberi Peaberry","Mostra Coffee","San Diego","United States"
"Kenya Ndumberi Peaberry","Mostra Coffee","San Diego","United States"
"Taiwan Alishan Espresso Pacamara Natural","Simon Hsieh Aroma Roast Coffees","Taoyuan","Taiwan"
"Ethiopia Gera Reserve Anaerobic Natural","Branch Street Coffee Roasters","Youngstown","United States"
"Kenya Ngaita Peaberry","Mostra Coffee","San Diego","United States"
"Kenya Ngaita Peaberry","Mostra Coffee","San Diego","United States"
"Kenya Ngaita Peaberry","Mostra Coffee","San Diego","United States"
"Kona Noir","Big Island Coffee Roasters","Mountain View","United States"
"Kona Red Bourbon","Big Island Coffee Roasters","Mountain View","United States"
"Ethiopia Nano Genji","Temple Coffee","Sacramento","United States"
"Guatemala Washed Acatenango Finca El General Pacamara Espresso","Kakalove Cafe","Chia-Yi","Taiwan"
"Guatemala Washed Acatenango Finca El General Pacamara Espresso","Kakalove Cafe","Chia-Yi","Taiwan"
"Finca Cerro Azul Aces Lot","Revel Coffee","Billings","United States"
"Finca Cerro Azul Aces Lot","Revel Coffee","Billings","United States"
"Finca Cerro Azul Aces Lot","Revel Coffee","Billings","United States"
"Gachatha Kenya","JBC Coffee Roasters","Madison","United States"
"Gachatha Kenya","JBC Coffee Roasters","Madison","United States"
"Gachatha Kenya","JBC Coffee Roasters","Madison","United States"
"Geisha Spirit","Cafe Kreyol","Manassas","United States"
"El Duende Peru","JBC Coffee Roasters","Madison","United States"
"El Duende Peru","JBC Coffee Roasters","Madison","United States"
"El Duende Peru","JBC Coffee Roasters","Madison","United States"
"Ethiopia Yirgacheffe G1 Idido Natural","GK Coffee","Yilan","China"
"Colombia Pink Bourbon Filadelfia","Bird Rock Coffee Roasters","San Diego","United States"
"Ethiopia Kayon Mountain","Yellow Brick Coffee","Tucson","United States"
"Karen J Kona Red Bourbon","Hula Daddy Kona Coffee","Holualoa","United States"
"Ethiopia Worka Sakaro","Red Rooster Coffee Roaster","Floyd","United States"
"Colombia Geisha","Jaunt Coffee Roasters","San Diego","United States"
"Colombia FUDAM Nariño","Roadmap CoffeeWorks","Lexington","United States"
"Ethiopia Durato Bombe","Per’la Specialty Roasters","Miami","United States"
"Pantan Musara Sumatra","JBC Coffee Roasters","Madison","United States"
"Sumatra Takengon Gayo Natural","Coffee By Design","Portland","United States"
"Sumatra Takengon Gayo Natural","Coffee By Design","Portland","United States"
"Panama Auromar Camilina Geisha Natural","Dragonfly Coffee Roasters","Henderson","United States"
"Tio Conejo Colombia","JBC Coffee Roasters","Madison","United States"
"Panama Auromar Ironman Geisha Washed Process","Dragonfly Coffee Roasters","Henderson","United States"
"Cruz Loma","JBC Coffee Roasters","Madison","United States"
"Panama Elida Washed Gesha","modcup coffee","Jersey City","United States"
"El Salvador Finca La Esperanza","Interpretation Coffee","Chia-Yi","Taiwan"
"El Salvador Finca La Esperanza","Interpretation Coffee","Chia-Yi","Taiwan"
"Panama Hacienda La Esmeralda Super Mario Geisha Yeast Washed","Quartet Kaffe","Taipei","Taiwan"
"Ethiopia Anasora Extended Natural Special Lot","Quartet Kaffe","Taipei","Taiwan"
"Ethiopia Honey Yirgacheffe Idido G1","Kakalove Cafe","Chia-Yi","Taiwan"
"Ethiopia Honey Yirgacheffe Idido G1","Kakalove Cafe","Chia-Yi","Taiwan"
"Taiwan Natural Alishan Ching-Ye Farm","Kakalove Cafe","Chia-Yi","Taiwan"
"Taiwan Natural Alishan Ching-Ye Farm","Kakalove Cafe","Chia-Yi","Taiwan"
"Hawaii Ka‘ū Bourbon Anaerobic Natural","Paradise Roasters","Hilo","United States"
"Chelchele Ethiopia","JBC Coffee Roasters","Madison","United States"
"Costa Rica Hacienda La Minita","RamsHead Coffee Roasters","Bozeman","United States"
"El Salvador Aida Batlle La Florida Natural","Moore Coffee","Ventura","United States"
"El Salvador Aida Batlle La Florida Natural","Moore Coffee","Ventura","United States"
"Colombia Geisha Cordillera","Nostalgia Coffee Roasters","San Diego","United States"
"Ethiopia Raro Boda","Bird Rock Coffee Roasters","San Diego","United States"
"Costa Rica Bounty Gesha","Barrington Coffee Roasting Co.","Lee","United States"
"Panama Static Gesha Natural","PT's Coffee Roasting Co.","Topeka","United States"
"Panama Static Gesha Natural","PT's Coffee Roasting Co.","Topeka","United States"
"Panama La Mula Geisha Washed","GK Coffee","Yilan","China"
"Esmeralda Estate Panama Geisha","Difference Coffee","London","United Kingdom"
"Esmeralda Estate Panama Geisha","Difference Coffee","London","United Kingdom"
"Costa Rica San Gabriel SL28 Anaerobic Natural","GK Coffee","Yilan","China"
"Burundi Kibingo Intenso","Regent Coffee","Glendale","United States"
"Ecuador Peñaherrera AAA","Bird Rock Coffee Roasters","San Diego","United States"
"Ecuador Peñaherrera AAA","Bird Rock Coffee Roasters","San Diego","United States"
"Panama Hacienda La Esmeralda Porton 5N49 Gesha Natural","PT's Coffee Roasting Co.","Topeka","United States"
"Panama Hacienda La Esmeralda Porton 5N49 Gesha Natural","PT's Coffee Roasting Co.","Topeka","United States"
"Kona SL34 Champagne Natural Uluwehi Farm","Paradise Roasters","Hilo","United States"
"Ethiopia Yirgacheffe Adado","Merge Coffee Company","Harrisonburg","United States"
"Tanzania Mbeya Mimba","Roadmap CoffeeWorks","Lexington","United States"
"Costa Rica La Chumeca","Roadmap CoffeeWorks","Lexington","United States"
"Costa Rica La Chumeca","Roadmap CoffeeWorks","Lexington","United States"
"Gesha Spirits","Mostra Coffee","San Diego","United States"
"Costa Rica Las Montañas Honey","Jackrabbit Java","Thermopolis","United States"
"Colombia Finca La Guaca Ají","Equator Coffees","San Rafael","United States"
"Kenya Washed Kiambu Uklili AB Espresso","Kakalove Cafe","Chia-Yi","Taiwan"
"Kenya Washed Kiambu Uklili AB Espresso","Kakalove Cafe","Chia-Yi","Taiwan"
"Kenya Washed Kiambu Uklili AB Espresso","Kakalove Cafe","Chia-Yi","Taiwan"
"Kenya Washed Kiambu Uklili AB Espresso","Kakalove Cafe","Chia-Yi","Taiwan"
"Karatina Kenya","JBC Coffee Roasters","Madison","United States"
"Karatina Kenya","JBC Coffee Roasters","Madison","United States"
"Karatina Kenya","JBC Coffee Roasters","Madison","United States"
"Colombia Tres Dragones Natural","PT's Coffee Roasting Co.","Topeka","United States"
"Colombia Finca Jardines del Eden Ice Fermentation Natural","GK Coffee","Yilan","China"
"Honduras Natural San Vicente Belarmino Contreras Pacas","Kakalove Cafe","Chia-Yi","Taiwan"
"Honduras Natural San Vicente Belarmino Contreras Pacas","Kakalove Cafe","Chia-Yi","Taiwan"
"Supernatural","Barrington Coffee Roasting","Lee","United States"
"Ethiopia Alemaza Natural SOE","Felala Coffee Lab","Taipei","Taiwan"
"Kona Natural Espresso","Hula Daddy Kona Coffee","Holualoa","United States"
"Colombia Pink Bourbon","Paradise Roasters","Hilo","United States"
"Peru Gesha","SkyTop Coffee","Manlius","United States"
"Ecuador Loja Hacienda La Papaya Bourbon Sidra 168hr Anaerobic Natural","Taster's Coffee","Taipei","Taiwan"
"Panama Finca Deborah Afterglow Geisha Natural","Mute Roaster","Macao","China"
"Colombia Exótico De Altura","Oak & Bond Coffee Company","Charlotte","United States"
"Colombia Wush Wush Dynamic Natural","SÖT Coffee Roaster","Osaka","Japan"
"Rwanda Gatare","Nostalgia Coffee Roasters","San Diego","United States"
"Costa Rica Naranjo Danilo Salazar Arias","Coffee by Design","Portland","United States"
"Costa Rica Naranjo Danilo Salazar Arias","Coffee by Design","Portland","United States"
"Costa Rica Naranjo Danilo Salazar Arias","Coffee by Design","Portland","United States"
"Ethiopia Guji Shakiso G1 Honey","VERYTIME","Taoyuan","Taiwan"
"Yemen Haraaz Red Mahal Aqeeq ul Station Natural","PT's Coffee Roasting Co.","Topeka","United States"
"Yemen Haraaz Red Mahal Aqeeq ul Station Natural","PT's Coffee Roasting Co.","Topeka","United States"
"Costa Rica Canet Musician Series Bach Raisin Honey","Cafe Red Bean Shop","Taipei","Taiwan"
"Peru Amazonas Los Santos Geisha Natural","Cafe Red Bean Shop","Taipei","Taiwan"
"Ethiopia Odola Washed","Ramshead Coffee Roasters","Bozeman","United States"
"Ka‘ū Tropical Punch Washed","Paradise Roasters","Hilo","United States"
"Ka‘ū Tropical Punch Washed","Paradise Roasters","Hilo","United States"
"Kenya Peaberry Top Hill Farm Espresso","GK Coffee","Yilan","China"
"Kenya Peaberry Top Hill Farm Espresso","GK Coffee","Yilan","China"
"Ethiopia Belayneh Bariso Natural","Ramshead Coffee Roasters","Bozeman","United States"
"Yemen Al Mashtal Al Burhani","Paradise Roasters","Hilo","United States"
"Ka‘ū Lactic Natural","Paradise Roasters","Hilo","United States"
"Ethiopia Guji Uraga Tebe Burku Natural","Cozy House Coffee","Taipei","Taiwan"
"Costa Rica Brunca Rivense Las Moras Black Honey","Cozy House Coffee","Taipei","Taiwan"
"Ethiopia Yirgacheffe Hama Washed","Cozy House Coffee","Taipei","Taiwan"
"Peru Washed Santa Monica Gesha","Kakalove Cafe","Chia-Yi","Taiwan"
"Peru Washed Santa Monica Gesha","Kakalove Cafe","Chia-Yi","Taiwan"
"Taiwan Washed Alishan Ching-Ye Farm SL34","Kakalove Cafe","Chia-Yi","Taiwan"
"Taiwan Washed Alishan Ching-Ye Farm SL34","Kakalove Cafe","Chia-Yi","Taiwan"
"Ethiopia Guji Odo Shakiso","Merge Coffee Company","Harrisonburg","United States"
"Ethiopia Sidamo Karamo","Jaunt Coffee Roasters","San Diego","United States"
"Gigesa Ethiopia","JBC Coffee Roasters","Madison","United States"
"Oahu Triple-Bourbon “Sparkling” Yeast Ferment","Rusty's Hawaiian","Pahala","United States"
"Colombia Ibague Tolima","Jaunt Coffee Roasters","San Diego","United States"
"Kenya Karatu","Roadmap Coffeeworks","Kiambu County","Kenya"
"Kenya Karatu","Roadmap Coffeeworks","Kiambu County","Kenya"
"Kenya Karatu","Roadmap Coffeeworks","Kiambu County","Kenya"
"Ecuador Taza Dorada Finca Cruz Loma","Paradise Roasters","Hilo","United States"
"Kona Bourbon Champagne Natural Uluwehi Farm","Paradise Roasters","Hilo","United States"
"Kona Bourbon Champagne Natural Uluwehi Farm","Paradise Roasters","Hilo","United States"
"Panama Hacienda La Esmeralda Geisha Washed","GK Coffee","Yilan","China"
"Peru Garden of Eden Farcent Geisha Anaerobic Washed","GK Coffee","Yilan","China"
"Pointu Laurina","Hula Daddy Kona Coffee","Holualoa","United States"
"Ecuador Finca Cruz Loma","Simon Hsieh Aroma Roast Coffees","Taoyuan","Taiwan"
"Aged Sumatra Semiga","Paradise Roasters","Hilo","United States"
"Ka’u Classic Dark","Rusty's Hawaiian","Pahala","United States"
"Sumatra Boru Batak","Bird Rock Coffee Roasters","San Diego","United States"
"Ethiopia Natural Guji Dasaya SP","Kakalove Cafe","Chia-Yi","Taiwan"
"Ethiopia Natural Guji Dasaya SP","Kakalove Cafe","Chia-Yi","Taiwan"
"Ethiopia Bensa Asefa Qonqana","Jaunt Coffee Roasters","San Diego","United States"
"Ethiopia Durato Bombe","Magnolia Coffee","Charlotte","United States"
"El Salvador Anarquia Pacamara","Tipico Coffee","Buffalo","United States"
"Colombia Finca El Paraiso Geisha Letty","Paradise Roasters","Hilo","United States"
"Monarch Estate Pacamara","Monarch Coffee","Holualoa","United States"
"Uluwehi Farm Kona SL34 Yeast-Fermentation Washed Peaberry","Paradise Roasters","Hilo","United States"
"Ka’u IPA Natural","Paradise Roasters","Hilo","United States"
"Ecuador Finca Lugmapata Mejorado","Paradise Roasters","Hilo","United States"
"Ecuador Finca Lugmapata Mejorado","Paradise Roasters","Hilo","United States"
"Cerro Azul Geisha Honey Process","JBC Coffee Roasters","Madison","United States"
"Karen J Kona Red Bourbon Natural Anaerobic","Hula Daddy Kona Coffee","Holualoa","United States"
"El Salvador Finca Mileydi Pacamara","Red Rooster Coffee Roaster","Floyd","United States"
"El Salvador Las Veraneras Red Bourbon","Red Rooster Coffee Roaster","Floyd","United States"
"Whiskey Dreams Moka Java","Old Soul Co.","Sacramento","United States"
"Karindundu Kenya","JBC Coffee Roasters","Madison","United States"
"Karindundu Kenya","JBC Coffee Roasters","Madison","United States"
"Karindundu Kenya","JBC Coffee Roasters","Madison","United States"
"Colombia Geisha Natural","Cafe Kreyol","Manassas","United States"
"Pacas Estate El Salvador Natural","Cafe Kreyol","Manassas","United States"
"Hunapu Natural Guatemala","JBC Coffee Roasters","Madison","United States"
"Hunapu Natural Guatemala","JBC Coffee Roasters","Madison","United States"
"Bedhatu Jibicho Natural","JBC Coffee Roasters","Madison","United States"
"Ethiopia Natural Guji DoReMi","Kakalove Cafe","Chia-Yi","Taiwan"
"Ethiopia Natural Guji DoReMi","Kakalove Cafe","Chia-Yi","Taiwan"
"Sabana Redonda SL28 Costa Rica","JBC Coffee Roasters","Madison","United States"
"Ethiopia Bench Maji Gesha Village Dimma Illubabor Forest A6 Natural","Taster's Coffee","Taipei","Taiwan"
"Sumatra Siamang Forest","Paradise Roasters","Hilo","United States"
"Kenya Gakuyuini AA","RamsHead Coffee Roasters","Bozeman","United States"
"Kenya Gakuyuini AA","RamsHead Coffee Roasters","Bozeman","United States"
"Kenya Gakuyuini AA","RamsHead Coffee Roasters","Bozeman","United States"
"Hacienda Esmeralda Ethiopian Accessions","modcup coffee","Jersey City","United States"
"Gelena Geisha","Corvus Coffee Roasters","Denver","United States"
"Ethiopia Anaerobic Natural","modcup coffee","Jersey City","United States"
"Kona Tropical Punch Washed","Paradise Roasters","Hilo","United States"
"Ka’u Bourbon Champagne Natural","Paradise Roasters","Hilo","United States"
"Cerro Azul Geisha","JBC Coffee Roasters","Madison","United States"
"Panama Mama Cata Geisha Champagne Natural","Paradise Roasters","Hilo","United States"
"Ethiopia Yirgacheffe Worka Sakaro","Paradise Roasters","Hilo","United States"
"El Socorro Maracaturra","Bird Rock Coffee Roasters","San Diego","United States"
"Guatemala Acatenango Gesha","Jaunt Coffee Roasters","San Diego","United States"
"Hacienda La Esmeralda Montañas 71AS","Difference Coffee","London","United Kingdom"
"Hacienda La Esmeralda Montañas 71AS","Difference Coffee","London","United Kingdom"
"Ethiopia Bench Maji Natural Gesha","VERYTIME","Taoyuan","Taiwan"
"Panama Hacienda La Esmeralda Gesha","modcup coffee","Jersey City","United States"
"Natural Ka’u Maragogipe","Big Island Coffee Roasters","Mountain View","United States"
"Natural Ka’u Maragogipe","Big Island Coffee Roasters","Mountain View","United States"
"Natural Ka’u Maragogipe","Big Island Coffee Roasters","Mountain View","United States"
"Costa Rica Volcan Azul San Isidro Red Honey","PT’s Coffee Roasting Co.","Topeka","United States"
"Ethiopia Demeka Becha","Red Rooster Coffee Roaster","Floyd","United States"
"Ethiopia Washed Sidama Bensa Bombe","Kakalove Cafe","Chia-Yi","Taiwan"
"Ethiopia Washed Sidama Bensa Bombe","Kakalove Cafe","Chia-Yi","Taiwan"
"Panama Abu Geisha Lot 6","Willoughby's Coffee & Tea","Branford","United States"
"Panama Finca Mi Finquita Geisha Afrodita Natural","Kakalove Cafe","Chia-Yi","Taiwan"
"Panama Finca Mi Finquita Geisha Afrodita Natural","Kakalove Cafe","Chia-Yi","Taiwan"
"Panama El Burro Estate Natural Gesha","Kakalove Cafe","Chia-Yi","Taiwan"
"Panama El Burro Estate Natural Gesha","Kakalove Cafe","Chia-Yi","Taiwan"
"Panama La Viuda Natural Geisha 4 Hermanos","Kakalove Cafe","Chia-Yi","Taiwan"
"Panama La Viuda Natural Geisha 4 Hermanos","Kakalove Cafe","Chia-Yi","Taiwan"
"Colombia Huila Finca Monteblanco Rodrigo Sanchez","Plat Coffee Roastery","Hong Kong","China"
"Colombia Huila Finca Monteblanco Rodrigo Sanchez","Plat Coffee Roastery","Hong Kong","China"
"Ninety Plus Panama Gesha Estate MS Joseph Brodsky 2307","Plat Coffee Roastery","Hong Kong","China"
"Ninety Plus Panama Gesha Estate MS Joseph Brodsky 2307","Plat Coffee Roastery","Hong Kong","China"
"Kona Mocca®","Hula Daddy Kona Coffee","Holualoa","United States"
"Ethiopia Wate Mini Natural Espresso","T.S.E. Custom Roastery","Taipei","Taiwan"
"Ethiopia Tamiru Tadesse Anaerobic","Genesis Coffee Lab","Big Lake","United States"
"Ethiopia Tamiru Tadesse Natural","Genesis Coffee Lab","Big Lake","United States"
"Puna Arakawa Estate Lactic Natural","Paradise Roasters","Hilo","United States"
"Puna Arakawa Estate Lactic Natural","Paradise Roasters","Hilo","United States"
"100% Kona Bourbon Pointu Laurina","Hula Daddy Kona Coffee","Holualoa","United States"
"Colombia Java El Eden","Durango Coffee Company","Durango","Mexico"
"Ethiopia Shantawene Natural","Nostalgia Coffee Roasters","San Diego","United States"
"Ethiopia Buno Dambi Uddo","Jaunt Coffee Roasters","San Diego","United States"
"Ethiopia Worka Sakaro Anaerobic Natural","Red Rock Roasters","Albuquerque","United States"
"Ethiopia Durato Bombe Natural","Oceana Coffee","Tequesta","United States"
"SÖT Coffee Roaster Colombia Wush Wush Dynamic Natural","SOT Coffee Roaster","Osaka","Japan"
"Colombia La Siria Geisha","Bird Rock Coffee Roasters","San Diego","United States"
"Guatemala Santa Felisa Wild Yeast Natural Gesha","Kakalove Cafe","Chia-Yi","Taiwan"
"Guatemala Santa Felisa Wild Yeast Natural Gesha","Kakalove Cafe","Chia-Yi","Taiwan"
"Colombia Granja La Esperanza Las Margaritas Gesha Honey","PT's Coffee Roasting Co.","Topeka","United States"
"Colombia Granja La Esperanza Las Margaritas Gesha Honey","PT's Coffee Roasting Co.","Topeka","United States"
"Tanzania Acacia Hills Gesha Peaberry","Chromatic Coffee","San Jose","United States"
